./corenlp/__init__.py,blacklist,B405,LOW,HIGH,https://cwe.mitre.org/data/definitions/20.html,"Using xml.etree.cElementTree to parse untrusted XML data is known to be vulnerable to XML attacks. Replace xml.etree.cElementTree with the equivalent defusedxml package, or make sure defusedxml.defuse_stdlib() is called.",1,0,35,[1],https://bandit.readthedocs.io/en/1.7.6/blacklists/blacklist_imports.html#b405-import-xml-etree
./corenlp/__init__.py,hardcoded_tmp_directory,B108,MEDIUM,MEDIUM,https://cwe.mitre.org/data/definitions/377.html,Probable insecure usage of temp file/directory.,182,15,33,[182],https://bandit.readthedocs.io/en/1.7.6/plugins/b108_hardcoded_tmp_directory.html
./corenlp/__init__.py,hardcoded_tmp_directory,B108,MEDIUM,MEDIUM,https://cwe.mitre.org/data/definitions/377.html,Probable insecure usage of temp file/directory.,183,30,48,[183],https://bandit.readthedocs.io/en/1.7.6/plugins/b108_hardcoded_tmp_directory.html
./corenlp/__init__.py,blacklist,B313,MEDIUM,HIGH,https://cwe.mitre.org/data/definitions/20.html,Using xml.etree.cElementTree.iterparse to parse untrusted XML data is known to be vulnerable to XML attacks. Replace xml.etree.cElementTree.iterparse with its defusedxml equivalent function or make sure defusedxml.defuse_stdlib() is called,254,23,68,[254],https://bandit.readthedocs.io/en/1.7.6/blacklists/blacklist_calls.html#b313-b320-xml-bad-celementtree
./corenlp/pipeline.py,blacklist,B404,LOW,HIGH,https://cwe.mitre.org/data/definitions/78.html,Consider possible security implications associated with the subprocess module.,3,0,17,[3],https://bandit.readthedocs.io/en/1.7.6/blacklists/blacklist_imports.html#b404-import-subprocess
./corenlp/pipeline.py,subprocess_popen_with_shell_equals_true,B602,HIGH,HIGH,https://cwe.mitre.org/data/definitions/78.html,"subprocess call with shell=True identified, security issue.",62,4,44,[62],https://bandit.readthedocs.io/en/1.7.6/plugins/b602_subprocess_popen_with_shell_equals_true.html
