./listable/views.py,hardcoded_sql_expressions,B608,MEDIUM,LOW,https://cwe.mitre.org/data/definitions/89.html,Possible SQL injection vector through string-based query construction.,150,37,65,[150],https://bandit.readthedocs.io/en/1.7.6/plugins/b608_hardcoded_sql_expressions.html
./listable/views.py,django_extra_used,B610,MEDIUM,MEDIUM,https://cwe.mitre.org/data/definitions/89.html,Use of extra potential SQL attack vector.,255,23,72,[255],https://bandit.readthedocs.io/en/1.7.6/plugins/b610_django_extra_used.html
./listable/views.py,django_extra_used,B610,MEDIUM,MEDIUM,https://cwe.mitre.org/data/definitions/89.html,Use of extra potential SQL attack vector.,318,33,138,[318],https://bandit.readthedocs.io/en/1.7.6/plugins/b610_django_extra_used.html
./listable/views.py,django_extra_used,B610,MEDIUM,MEDIUM,https://cwe.mitre.org/data/definitions/89.html,Use of extra potential SQL attack vector.,327,33,119,[327],https://bandit.readthedocs.io/en/1.7.6/plugins/b610_django_extra_used.html
./setup.py,start_process_with_a_shell,B605,LOW,HIGH,https://cwe.mitre.org/data/definitions/78.html,"Starting a process with a shell: Seems safe, but may be changed in the future, consider rewriting without shell",16,4,45,[16],https://bandit.readthedocs.io/en/1.7.6/plugins/b605_start_process_with_a_shell.html
./setup.py,start_process_with_partial_path,B607,LOW,HIGH,https://cwe.mitre.org/data/definitions/78.html,Starting a process with a partial executable path,16,4,45,[16],https://bandit.readthedocs.io/en/1.7.6/plugins/b607_start_process_with_partial_path.html
