./mock/tests/testhelpers.py,exec_used,B102,MEDIUM,HIGH,https://cwe.mitre.org/data/definitions/78.html,Use of exec detected.,410,8,34,[410],https://bandit.readthedocs.io/en/1.7.6/plugins/b102_exec_used.html
./mock/tests/testmagicmethods.py,exec_used,B102,MEDIUM,HIGH,https://cwe.mitre.org/data/definitions/78.html,Use of exec detected.,500,8,17,[500],https://bandit.readthedocs.io/en/1.7.6/plugins/b102_exec_used.html
./mock/tests/testmock.py,blacklist,B403,LOW,HIGH,https://cwe.mitre.org/data/definitions/502.html,Consider possible security implications associated with pickle module.,6,0,13,[6],https://bandit.readthedocs.io/en/1.7.6/blacklists/blacklist_imports.html#b403-import-pickle
./mock/tests/testmock.py,exec_used,B102,MEDIUM,HIGH,https://cwe.mitre.org/data/definitions/78.html,Use of exec detected.,74,8,34,[74],https://bandit.readthedocs.io/en/1.7.6/plugins/b102_exec_used.html
./mock/tests/testmock.py,blacklist,B301,MEDIUM,HIGH,https://cwe.mitre.org/data/definitions/502.html,"Pickle and modules that wrap it can be unsafe when used to deserialize untrusted data, possible security issue.",1582,18,36,[1582],https://bandit.readthedocs.io/en/1.7.6/blacklists/blacklist_calls.html#b301-pickle
./mock/tests/testpatch.py,blacklist,B307,MEDIUM,HIGH,https://cwe.mitre.org/data/definitions/78.html,Use of possibly insecure function - consider using safer ast.literal_eval.,1877,18,43,[1877],https://bandit.readthedocs.io/en/1.7.6/blacklists/blacklist_calls.html#b307-eval
./mock/tests/testwith.py,try_except_pass,B110,LOW,HIGH,https://cwe.mitre.org/data/definitions/703.html,"Try, Except, Pass detected.",31,8,16,"[31, 32]",https://bandit.readthedocs.io/en/1.7.6/plugins/b110_try_except_pass.html
