./mock.py,assert_used,B101,LOW,HIGH,https://cwe.mitre.org/data/definitions/703.html,Use of assert detected. The enclosed code will be removed when compiling to optimised byte code.,101,4,40,[101],https://bandit.readthedocs.io/en/1.7.6/plugins/b101_assert_used.html
./mock.py,assert_used,B101,LOW,HIGH,https://cwe.mitre.org/data/definitions/703.html,Use of assert detected. The enclosed code will be removed when compiling to optimised byte code.,103,8,44,[103],https://bandit.readthedocs.io/en/1.7.6/plugins/b101_assert_used.html
./mock.py,assert_used,B101,LOW,HIGH,https://cwe.mitre.org/data/definitions/703.html,Use of assert detected. The enclosed code will be removed when compiling to optimised byte code.,105,8,46,[105],https://bandit.readthedocs.io/en/1.7.6/plugins/b101_assert_used.html
./mock.py,blacklist,B307,MEDIUM,HIGH,https://cwe.mitre.org/data/definitions/78.html,Use of possibly insecure function - consider using safer ast.literal_eval.,151,14,42,[151],https://bandit.readthedocs.io/en/1.7.6/blacklists/blacklist_calls.html#b307-eval
./tests/_testwith.py,try_except_pass,B110,LOW,HIGH,https://cwe.mitre.org/data/definitions/703.html,"Try, Except, Pass detected.",29,8,16,"[29, 30]",https://bandit.readthedocs.io/en/1.7.6/plugins/b110_try_except_pass.html
./tests/testmock.py,exec_used,B102,MEDIUM,HIGH,https://cwe.mitre.org/data/definitions/78.html,Use of exec detected.,25,8,34,[25],https://bandit.readthedocs.io/en/1.7.6/plugins/b102_exec_used.html
