./syntax/maltparser/dependencygraph.py,blacklist,B404,LOW,HIGH,https://cwe.mitre.org/data/definitions/78.html,Consider possible security implications associated with the subprocess module.,21,0,17,[21],https://bandit.readthedocs.io/en/1.7.6/blacklists/blacklist_imports.html#b404-import-subprocess
./syntax/maltparser/dependencygraph.py,start_process_with_partial_path,B607,LOW,HIGH,https://cwe.mitre.org/data/definitions/78.html,Starting a process with a partial executable path,158,22,86,"[158, 159]",https://bandit.readthedocs.io/en/1.7.6/plugins/b607_start_process_with_partial_path.html
./syntax/maltparser/dependencygraph.py,subprocess_without_shell_equals_true,B603,LOW,HIGH,https://cwe.mitre.org/data/definitions/78.html,subprocess call - check for execution of untrusted input.,158,22,86,"[158, 159]",https://bandit.readthedocs.io/en/1.7.6/plugins/b603_subprocess_without_shell_equals_true.html
./syntax/maltparser/dependencygraph.py,assert_used,B101,LOW,HIGH,https://cwe.mitre.org/data/definitions/703.html,Use of assert detected. The enclosed code will be removed when compiling to optimised byte code.,265,16,48,[265],https://bandit.readthedocs.io/en/1.7.6/plugins/b101_assert_used.html
./syntax/maltparser/malt.py,blacklist,B404,LOW,HIGH,https://cwe.mitre.org/data/definitions/78.html,Consider possible security implications associated with the subprocess module.,6,0,17,[6],https://bandit.readthedocs.io/en/1.7.6/blacklists/blacklist_imports.html#b404-import-subprocess
./syntax/maltparser/malt.py,subprocess_without_shell_equals_true,B603,LOW,HIGH,https://cwe.mitre.org/data/definitions/78.html,subprocess call - check for execution of untrusted input.,226,12,63,[226],https://bandit.readthedocs.io/en/1.7.6/plugins/b603_subprocess_without_shell_equals_true.html
