./sockjs/protocol.py,blacklist,B303,MEDIUM,HIGH,https://cwe.mitre.org/data/definitions/327.html,"Use of insecure MD2, MD4, MD5, or SHA1 hash function.",72,13,46,[72],https://bandit.readthedocs.io/en/1.7.6/blacklists/blacklist_calls.html#b303-md5
./sockjs/route.py,assert_used,B101,LOW,HIGH,https://cwe.mitre.org/data/definitions/703.html,Use of assert detected. The enclosed code will be removed when compiling to optimised byte code.,28,4,37,[28],https://bandit.readthedocs.io/en/1.7.6/plugins/b101_assert_used.html
./sockjs/route.py,blacklist,B303,MEDIUM,HIGH,https://cwe.mitre.org/data/definitions/327.html,"Use of insecure MD2, MD4, MD5, or SHA1 hash function.",109,31,60,[109],https://bandit.readthedocs.io/en/1.7.6/blacklists/blacklist_calls.html#b303-md5
./sockjs/route.py,blacklist,B311,LOW,HIGH,https://cwe.mitre.org/data/definitions/330.html,Standard pseudo-random generators are not suitable for security/cryptographic purposes.,151,24,53,[151],https://bandit.readthedocs.io/en/1.7.6/blacklists/blacklist_calls.html#b311-random
./sockjs/route.py,blacklist,B311,LOW,HIGH,https://cwe.mitre.org/data/definitions/330.html,Standard pseudo-random generators are not suitable for security/cryptographic purposes.,173,27,56,[173],https://bandit.readthedocs.io/en/1.7.6/blacklists/blacklist_calls.html#b311-random
./sockjs/transports/base.py,assert_used,B101,LOW,HIGH,https://cwe.mitre.org/data/definitions/703.html,Use of assert detected. The enclosed code will be removed when compiling to optimised byte code.,41,8,70,[41],https://bandit.readthedocs.io/en/1.7.6/plugins/b101_assert_used.html
