./build/compilers.py,blacklist,B404,LOW,HIGH,https://cwe.mitre.org/data/definitions/78.html,Consider possible security implications associated with the subprocess module.,4,0,17,[4],https://bandit.readthedocs.io/en/1.7.6/blacklists/blacklist_imports.html#b404-import-subprocess
./build/compilers.py,blacklist,B311,LOW,HIGH,https://cwe.mitre.org/data/definitions/330.html,Standard pseudo-random generators are not suitable for security/cryptographic purposes.,12,27,42,[12],https://bandit.readthedocs.io/en/1.7.6/blacklists/blacklist_calls.html#b311-random
./build/compilers.py,start_process_with_partial_path,B607,LOW,HIGH,https://cwe.mitre.org/data/definitions/78.html,Starting a process with a partial executable path,21,4,47,[21],https://bandit.readthedocs.io/en/1.7.6/plugins/b607_start_process_with_partial_path.html
./build/compilers.py,subprocess_without_shell_equals_true,B603,LOW,HIGH,https://cwe.mitre.org/data/definitions/78.html,subprocess call - check for execution of untrusted input.,21,4,47,[21],https://bandit.readthedocs.io/en/1.7.6/plugins/b603_subprocess_without_shell_equals_true.html
./setup.py,blacklist,B404,LOW,HIGH,https://cwe.mitre.org/data/definitions/78.html,Consider possible security implications associated with the subprocess module.,16,4,21,[16],https://bandit.readthedocs.io/en/1.7.6/blacklists/blacklist_imports.html#b404-import-subprocess
./setup.py,start_process_with_partial_path,B607,LOW,HIGH,https://cwe.mitre.org/data/definitions/78.html,Starting a process with a partial executable path,18,8,9,"[18, 19, 20]",https://bandit.readthedocs.io/en/1.7.6/plugins/b607_start_process_with_partial_path.html
./setup.py,subprocess_without_shell_equals_true,B603,LOW,HIGH,https://cwe.mitre.org/data/definitions/78.html,subprocess call - check for execution of untrusted input.,18,8,9,"[18, 19, 20]",https://bandit.readthedocs.io/en/1.7.6/plugins/b603_subprocess_without_shell_equals_true.html
